{
  "policy_version": 1,
  "status": "active",
  "provider": "github-actions",
  "repository": "naelmusleh/flaglite-fw020-pilot",
  "protected_ref": "refs/heads/main",
  "signer_workflow": "naelmusleh/adversarial-sdd-boilerplate/.github/workflows/sdd-trusted-ci-attest.yml",
  "signer_digest": "484c4cc3c7d1c0962439d11197fc09473845c163"
}
